[
  {
    "apiVersion": "anthropic.com/v1",
    "kind": "AlloyDbTableSemantics",
    "metadata": {
      "name": "dim_cache_key",
      "labels": {
        "lane": "semantic-cache",
        "source": "scripts/load-citation-warehouse.ts"
      }
    },
    "spec": {
      "version": "1.0.0",
      "schema": "dw",
      "description": "Catalog of tiered-cache keys observed in semantic_cache (L3) and the events_cache_access stream. SCD II — a key whose source_path lineage changes closes its old row, so the provenance history of every cached fact stays auditable. Conformed dimension for fact_cache_hits.",
      "columns": [
        {
          "name": "cache_key",
          "sql_type": "text",
          "description": "namespaced cache key (ke:<lane>:<id>), natural key",
          "kind": "dimension"
        },
        {
          "name": "lane",
          "sql_type": "text",
          "description": "lane parsed from the key namespace; NULL when unnamespaced",
          "kind": "dimension"
        },
        {
          "name": "source_path",
          "sql_type": "text",
          "description": "originating repo path from semantic_cache; NULL when synthesized",
          "kind": "dimension"
        },
        {
          "name": "row_effective_from",
          "sql_type": "timestamptz",
          "description": "SCD II validity start",
          "kind": "time_dimension"
        },
        {
          "name": "row_effective_to",
          "sql_type": "timestamptz",
          "description": "SCD II validity end; infinity while current",
          "kind": "time_dimension"
        },
        {
          "name": "is_current",
          "sql_type": "boolean",
          "description": "current-row flag",
          "kind": "dimension"
        }
      ],
      "codeowners": [
        "subagentceo",
        "alex@opensubagents.com"
      ],
      "sla_policy": "refreshed by every dw:load run",
      "data_start_date": "2026-06-12",
      "load_type": "incremental",
      "allowed_operations": [
        "read",
        "scd2_rewrite"
      ]
    },
    "table_kind": "dim",
    "scd_type": 2
  },
  {
    "apiVersion": "anthropic.com/v1",
    "kind": "AlloyDbTableSemantics",
    "metadata": {
      "name": "dim_memory",
      "labels": {
        "lane": "citation-memory",
        "shape": "managed-agents memory (path + content)"
      }
    },
    "spec": {
      "version": "1.3.0",
      "schema": "dw",
      "description": "Citation memories in the managed-agents memory shape (path + content), one current row per memory path. SCD II — dreams-curated rewrites of a memory's content close the old row so curation history is auditable. Source memories are derived from csl_items; curated ones are written by the dreams consolidation job (B3).",
      "columns": [
        {
          "name": "memory_path",
          "sql_type": "text",
          "description": "memory path (/citations/<csl-id-slug>.md), natural key",
          "kind": "dimension"
        },
        {
          "name": "content",
          "sql_type": "text",
          "description": "markdown memory body (citation summary + CSL-JSON block)",
          "kind": "dimension"
        },
        {
          "name": "csl_id",
          "sql_type": "text",
          "description": "originating csl_items.id; NULL for synthesized memories",
          "kind": "dimension"
        },
        {
          "name": "curation_source",
          "sql_type": "text",
          "description": "ingest | dreams | agent — who wrote this version of the memory",
          "kind": "dimension"
        },
        {
          "name": "row_effective_from",
          "sql_type": "timestamptz",
          "description": "SCD II validity start",
          "kind": "time_dimension"
        }
      ],
      "codeowners": [
        "subagentceo",
        "alex@opensubagents.com"
      ],
      "sla_policy": "curated within 24h of dreams tick",
      "data_start_date": "2026-06-09",
      "load_type": "incremental",
      "allowed_operations": [
        "read",
        "scd2_rewrite"
      ]
    },
    "table_kind": "dim",
    "scd_type": 2
  },
  {
    "apiVersion": "anthropic.com/v1",
    "kind": "AlloyDbTableSemantics",
    "metadata": {
      "name": "dim_research_doc",
      "labels": {
        "lane": "economic-research",
        "source": "vendor/anthropic-sitemap"
      }
    },
    "spec": {
      "version": "1.2.0",
      "schema": "dw",
      "description": "Anthropic research documents mirrored under vendor/anthropic-sitemap/{research,_pdfs}, one current row per doc. SCD II — title/abstract/URL changes close the old row and open a new one so citation provenance is auditable over crawls.",
      "columns": [
        {
          "name": "csl_id",
          "sql_type": "text",
          "description": "CSL item id (anthropic-sitemap:research:<slug>), natural key",
          "kind": "dimension"
        },
        {
          "name": "title",
          "sql_type": "text",
          "description": "document H1 title at crawl time",
          "kind": "dimension"
        },
        {
          "name": "doc_type",
          "sql_type": "text",
          "description": "CSL type — article (research page) or document (_pdfs mirror)",
          "kind": "dimension"
        },
        {
          "name": "url",
          "sql_type": "text",
          "description": "live anthropic.com URL; NULL for hash-named pdf mirrors",
          "kind": "dimension"
        },
        {
          "name": "research_team",
          "sql_type": "text",
          "description": "owning team page (economic-research first; null when unattributed)",
          "kind": "dimension"
        },
        {
          "name": "issued_date",
          "sql_type": "date",
          "description": "publication date parsed from the page (NULL when undated)",
          "kind": "time_dimension"
        },
        {
          "name": "row_effective_from",
          "sql_type": "timestamptz",
          "description": "SCD II validity start",
          "kind": "time_dimension"
        }
      ],
      "codeowners": [
        "subagentceo",
        "alex@opensubagents.com"
      ],
      "sla_policy": "refresh within 24h of vendor crawl",
      "data_start_date": "2026-06-09",
      "load_type": "incremental",
      "allowed_operations": [
        "read",
        "scd2_rewrite"
      ]
    },
    "table_kind": "dim",
    "scd_type": 2
  },
  {
    "apiVersion": "anthropic.com/v1",
    "kind": "AlloyDbTableSemantics",
    "metadata": {
      "name": "dim_vendor",
      "labels": {
        "lane": "full-corpus",
        "source": "src/lib/vendor-corpus.ts"
      }
    },
    "spec": {
      "version": "1.2.0",
      "schema": "dw",
      "description": "One row per mirrored vendor under vendor/. SCD I — corpus counts and crawl freshness overwrite in place; history lives in fact_vendor_crawl, not here.",
      "columns": [
        {
          "name": "vendor_name",
          "sql_type": "text",
          "description": "vendor directory name (natural key)",
          "kind": "dimension"
        },
        {
          "name": "host",
          "sql_type": "text",
          "description": "reconstructed doc host; NULL when unmapped (never guessed)",
          "kind": "dimension"
        },
        {
          "name": "doc_count",
          "sql_type": "bigint",
          "description": "tracked markdown docs in the current corpus",
          "kind": "measure",
          "measure_type": "count"
        },
        {
          "name": "last_loaded_at",
          "sql_type": "timestamptz",
          "description": "last warehouse load touching this vendor",
          "kind": "time_dimension"
        }
      ],
      "codeowners": [
        "subagentceo",
        "alex@opensubagents.com"
      ],
      "sla_policy": "refresh on every dw:load",
      "data_start_date": "2026-06-09",
      "load_type": "full",
      "allowed_operations": [
        "read",
        "scd1_overwrite"
      ]
    },
    "table_kind": "dim",
    "scd_type": 1
  },
  {
    "apiVersion": "anthropic.com/v1",
    "kind": "AlloyDbTableSemantics",
    "metadata": {
      "name": "events_cache_access",
      "labels": {
        "lane": "semantic-cache",
        "source": "src/cache/events.ts"
      }
    },
    "spec": {
      "version": "1.0.0",
      "schema": "dw",
      "description": "Append-only access log of the three-tier semantic cache. Every get/set against L1 (in-process LRU), L2 (Redis) and L3 (Postgres semantic_cache) appends one row. Never UPDATE, never DELETE — this is the raw event stream the fact_cache_hits rollup aggregates.",
      "columns": [
        {
          "name": "cache_key",
          "sql_type": "text",
          "description": "namespaced cache key (ke:<lane>:<id>)",
          "kind": "dimension"
        },
        {
          "name": "tier",
          "sql_type": "text",
          "description": "cache tier the operation resolved at — L1, L2 or L3",
          "kind": "dimension"
        },
        {
          "name": "op",
          "sql_type": "text",
          "description": "operation outcome — hit, miss, set, invalidate or promote",
          "kind": "dimension"
        },
        {
          "name": "lane",
          "sql_type": "text",
          "description": "originating lane parsed from the key namespace; NULL when unnamespaced",
          "kind": "dimension"
        },
        {
          "name": "occurred_at",
          "sql_type": "timestamptz",
          "description": "operation wall-clock time",
          "kind": "time_dimension"
        }
      ],
      "codeowners": [
        "subagentceo",
        "alex@opensubagents.com"
      ],
      "sla_policy": "append at access time via buffered sink; never mutated",
      "data_start_date": "2026-06-12",
      "load_type": "append_only",
      "allowed_operations": [
        "read",
        "append"
      ]
    },
    "table_kind": "events",